[
  {
    "dictionary": "CET4_T.json",
    "sourceCount": 2607,
    "acceptedCount": 2607,
    "rejectedCount": 0,
    "deduplicatedCount": 0,
    "isBalanced": true,
    "rejectionDetails": [],
    "deduplicationDetails": []
  },
  {
    "dictionary": "CET-4-frequency.json",
    "sourceCount": 2607,
    "acceptedCount": 2607,
    "rejectedCount": 0,
    "deduplicatedCount": 0,
    "isBalanced": true,
    "rejectionDetails": [],
    "deduplicationDetails": []
  },
  {
    "dictionary": "CET6_T.json",
    "sourceCount": 2345,
    "acceptedCount": 2345,
    "rejectedCount": 0,
    "deduplicatedCount": 0,
    "isBalanced": true,
    "rejectionDetails": [],
    "deduplicationDetails": []
  },
  {
    "dictionary": "KaoYan_3_T.json",
    "sourceCount": 3725,
    "acceptedCount": 3725,
    "rejectedCount": 0,
    "deduplicatedCount": 0,
    "isBalanced": true,
    "rejectionDetails": [],
    "deduplicationDetails": []
  },
  {
    "dictionary": "Level4luan_2_T.json",
    "sourceCount": 3994,
    "acceptedCount": 3994,
    "rejectedCount": 0,
    "deduplicatedCount": 0,
    "isBalanced": true,
    "rejectionDetails": [],
    "deduplicationDetails": []
  },
  {
    "dictionary": "Level8luan_2_T.json",
    "sourceCount": 12083,
    "acceptedCount": 12083,
    "rejectedCount": 0,
    "deduplicatedCount": 0,
    "isBalanced": true,
    "rejectionDetails": [],
    "deduplicationDetails": []
  },
  {
    "dictionary": "IELTS_3_T.json",
    "sourceCount": 3557,
    "acceptedCount": 3557,
    "rejectedCount": 0,
    "deduplicatedCount": 0,
    "isBalanced": true,
    "rejectionDetails": [],
    "deduplicationDetails": []
  },
  {
    "dictionary": "TOEFL_3_T.json",
    "sourceCount": 4220,
    "acceptedCount": 4220,
    "rejectedCount": 0,
    "deduplicatedCount": 0,
    "isBalanced": true,
    "rejectionDetails": [],
    "deduplicationDetails": []
  },
  {
    "dictionary": "GaoKao_3500.json",
    "sourceCount": 3861,
    "acceptedCount": 3861,
    "rejectedCount": 0,
    "deduplicatedCount": 0,
    "isBalanced": true,
    "rejectionDetails": [],
    "deduplicationDetails": []
  },
  {
    "dictionary": "nce-new-1.json",
    "sourceCount": 863,
    "acceptedCount": 863,
    "rejectedCount": 0,
    "deduplicatedCount": 0,
    "isBalanced": true,
    "rejectionDetails": [],
    "deduplicationDetails": []
  },
  {
    "dictionary": "nce-new-2.json",
    "sourceCount": 838,
    "acceptedCount": 838,
    "rejectedCount": 0,
    "deduplicatedCount": 0,
    "isBalanced": true,
    "rejectionDetails": [],
    "deduplicationDetails": []
  },
  {
    "dictionary": "nce-new-3.json",
    "sourceCount": 1039,
    "acceptedCount": 1039,
    "rejectedCount": 0,
    "deduplicatedCount": 0,
    "isBalanced": true,
    "rejectionDetails": [],
    "deduplicationDetails": []
  },
  {
    "dictionary": "nce-new-4.json",
    "sourceCount": 775,
    "acceptedCount": 775,
    "rejectedCount": 0,
    "deduplicatedCount": 0,
    "isBalanced": true,
    "rejectionDetails": [],
    "deduplicationDetails": []
  },
  {
    "dictionary": "xinghuoqiaoji_4.json",
    "sourceCount": 2417,
    "acceptedCount": 2417,
    "rejectedCount": 0,
    "deduplicatedCount": 0,
    "isBalanced": true,
    "rejectionDetails": [],
    "deduplicationDetails": []
  },
  {
    "dictionary": "xinghuoqiaoji_6.json",
    "sourceCount": 5995,
    "acceptedCount": 5995,
    "rejectedCount": 0,
    "deduplicatedCount": 0,
    "isBalanced": true,
    "rejectionDetails": [],
    "deduplicationDetails": []
  },
  {
    "dictionary": "DanCiDeJianFa_4.json",
    "sourceCount": 1679,
    "acceptedCount": 1679,
    "rejectedCount": 0,
    "deduplicatedCount": 0,
    "isBalanced": true,
    "rejectionDetails": [],
    "deduplicationDetails": []
  },
  {
    "dictionary": "DanCiDeJianFa_6.json",
    "sourceCount": 1741,
    "acceptedCount": 1741,
    "rejectedCount": 0,
    "deduplicatedCount": 0,
    "isBalanced": true,
    "rejectionDetails": [],
    "deduplicationDetails": []
  },
  {
    "dictionary": "KaoYan_2024.json",
    "sourceCount": 3722,
    "acceptedCount": 3722,
    "rejectedCount": 0,
    "deduplicatedCount": 0,
    "isBalanced": true,
    "rejectionDetails": [],
    "deduplicationDetails": []
  },
  {
    "dictionary": "KaoYanShanGuo_2023.json",
    "sourceCount": 1771,
    "acceptedCount": 1771,
    "rejectedCount": 0,
    "deduplicatedCount": 0,
    "isBalanced": true,
    "rejectionDetails": [],
    "deduplicationDetails": []
  },
  {
    "dictionary": "926.json",
    "sourceCount": 926,
    "acceptedCount": 926,
    "rejectedCount": 0,
    "deduplicatedCount": 0,
    "isBalanced": true,
    "rejectionDetails": [],
    "deduplicationDetails": []
  },
  {
    "dictionary": "DanCiDeMimi_1.json",
    "sourceCount": 4251,
    "acceptedCount": 4251,
    "rejectedCount": 0,
    "deduplicatedCount": 0,
    "isBalanced": true,
    "rejectionDetails": [],
    "deduplicationDetails": []
  },
  {
    "dictionary": "DanCiDeMimi_2.json",
    "sourceCount": 2848,
    "acceptedCount": 2848,
    "rejectedCount": 0,
    "deduplicatedCount": 0,
    "isBalanced": true,
    "rejectionDetails": [],
    "deduplicationDetails": []
  },
  {
    "dictionary": "2024HongBao_T1.json",
    "sourceCount": 997,
    "acceptedCount": 997,
    "rejectedCount": 0,
    "deduplicatedCount": 0,
    "isBalanced": true,
    "rejectionDetails": [],
    "deduplicationDetails": []
  },
  {
    "dictionary": "2024HongBao_T2.json",
    "sourceCount": 854,
    "acceptedCount": 854,
    "rejectedCount": 0,
    "deduplicatedCount": 0,
    "isBalanced": true,
    "rejectionDetails": [],
    "deduplicationDetails": []
  },
  {
    "dictionary": "hongbaoshu-2026.json",
    "sourceCount": 4770,
    "acceptedCount": 4770,
    "rejectedCount": 0,
    "deduplicatedCount": 0,
    "isBalanced": true,
    "rejectionDetails": [],
    "deduplicationDetails": []
  },
  {
    "dictionary": "English_II.json",
    "sourceCount": 4451,
    "acceptedCount": 4451,
    "rejectedCount": 0,
    "deduplicatedCount": 0,
    "isBalanced": true,
    "rejectionDetails": [],
    "deduplicationDetails": []
  },
  {
    "dictionary": "kaoyanshanguo2025.json",
    "sourceCount": 2254,
    "acceptedCount": 2254,
    "rejectedCount": 0,
    "deduplicatedCount": 0,
    "isBalanced": true,
    "rejectionDetails": [],
    "deduplicationDetails": []
  },
  {
    "dictionary": "PETS_3.json",
    "sourceCount": 1940,
    "acceptedCount": 1940,
    "rejectedCount": 0,
    "deduplicatedCount": 0,
    "isBalanced": true,
    "rejectionDetails": [],
    "deduplicationDetails": []
  },
  {
    "dictionary": "PETS3-2023.json",
    "sourceCount": 4432,
    "acceptedCount": 4432,
    "rejectedCount": 0,
    "deduplicatedCount": 0,
    "isBalanced": true,
    "rejectionDetails": [],
    "deduplicationDetails": []
  },
  {
    "dictionary": "self-study_English1.json",
    "sourceCount": 1797,
    "acceptedCount": 1797,
    "rejectedCount": 0,
    "deduplicatedCount": 0,
    "isBalanced": true,
    "rejectionDetails": [],
    "deduplicationDetails": []
  },
  {
    "dictionary": "self-study_English2.json",
    "sourceCount": 2170,
    "acceptedCount": 2170,
    "rejectedCount": 0,
    "deduplicatedCount": 0,
    "isBalanced": true,
    "rejectionDetails": [],
    "deduplicationDetails": []
  },
  {
    "dictionary": "self-study_English3.json",
    "sourceCount": 4156,
    "acceptedCount": 4156,
    "rejectedCount": 0,
    "deduplicatedCount": 0,
    "isBalanced": true,
    "rejectionDetails": [],
    "deduplicationDetails": []
  },
  {
    "dictionary": "4000_Essential_English_Words-meaning.json",
    "sourceCount": 3593,
    "acceptedCount": 3593,
    "rejectedCount": 0,
    "deduplicatedCount": 0,
    "isBalanced": true,
    "rejectionDetails": [],
    "deduplicationDetails": []
  },
  {
    "dictionary": "Longman_Communication_3000.json",
    "sourceCount": 3157,
    "acceptedCount": 3157,
    "rejectedCount": 0,
    "deduplicatedCount": 0,
    "isBalanced": true,
    "rejectionDetails": [],
    "deduplicationDetails": []
  },
  {
    "dictionary": "top2000words.json",
    "sourceCount": 1865,
    "acceptedCount": 1865,
    "rejectedCount": 0,
    "deduplicatedCount": 0,
    "isBalanced": true,
    "rejectionDetails": [],
    "deduplicationDetails": []
  },
  {
    "dictionary": "Top1500NounWords.json",
    "sourceCount": 1525,
    "acceptedCount": 1525,
    "rejectedCount": 0,
    "deduplicatedCount": 0,
    "isBalanced": true,
    "rejectionDetails": [],
    "deduplicationDetails": []
  },
  {
    "dictionary": "Top1000VerbWords.json",
    "sourceCount": 1011,
    "acceptedCount": 1011,
    "rejectedCount": 0,
    "deduplicatedCount": 0,
    "isBalanced": true,
    "rejectionDetails": [],
    "deduplicationDetails": []
  },
  {
    "dictionary": "Top500AdjectiveWords.json",
    "sourceCount": 527,
    "acceptedCount": 527,
    "rejectedCount": 0,
    "deduplicatedCount": 0,
    "isBalanced": true,
    "rejectionDetails": [],
    "deduplicationDetails": []
  },
  {
    "dictionary": "Top250AdverbWords.json",
    "sourceCount": 255,
    "acceptedCount": 255,
    "rejectedCount": 0,
    "deduplicatedCount": 0,
    "isBalanced": true,
    "rejectionDetails": [],
    "deduplicationDetails": []
  },
  {
    "dictionary": "Top60Pronouns.json",
    "sourceCount": 59,
    "acceptedCount": 59,
    "rejectedCount": 0,
    "deduplicatedCount": 0,
    "isBalanced": true,
    "rejectionDetails": [],
    "deduplicationDetails": []
  },
  {
    "dictionary": "Top50Prepositions.json",
    "sourceCount": 46,
    "acceptedCount": 46,
    "rejectedCount": 0,
    "deduplicatedCount": 0,
    "isBalanced": true,
    "rejectionDetails": [],
    "deduplicationDetails": []
  },
  {
    "dictionary": "adult-self-study-examination.json",
    "sourceCount": 3690,
    "acceptedCount": 3690,
    "rejectedCount": 0,
    "deduplicatedCount": 0,
    "isBalanced": true,
    "rejectionDetails": [],
    "deduplicationDetails": []
  },
  {
    "dictionary": "zhuan-cha-ben.json",